{
  "$schema": "http://json-schema.org/draft-07/schema#",
  "type": "object",
  "properties": {
    "id": {
      "type": "string",
      "pattern": "^[a-z0-9]+(-[a-z0-9]+)*$"
    },
    "type": {
      "type": "string",
      "enum": [
        "Хууль",
        "Хуулийн төсөл",
        "УИХ-ын тогтоол",
        "Олон улсын гэрээ",
        "Засгийн газрын тогтоол",
        "Журам",
        "Хөрөнгө оруулалтын төсөл",
        "Засгийн газрын мэдэгдэл"
      ]
    },
    "stage": {
      "type": "string",
      "enum": [
        "Санал авч байна",
        "Өргөн мэдүүлсэн",
        "Хэлэлцэх эсэх",
        "Анхны хэлэлцүүлэг",
        "Эцсийн хэлэлцүүлэг",
        "Батлагдсан",
        "Ерөнхийлөгчийн хориг",
        "Нийтлэгдсэн",
        "Мөрдөж эхэлсэн",
        "Идэвхтэй",
        "Санал авч дууссан",
        "Дүгнэлт гаргасан",
        "Баталсан",
        "Цуцалсан",
        "Танилцуулсан",
        "Хэрэгжиж байна"
      ]
    },
    "topics": {
      "minItems": 1,
      "type": "array",
      "items": {
        "type": "string",
        "enum": [
          "Татвар",
          "Төсөв ба санхүү",
          "Орон сууц",
          "Боловсрол",
          "Эрүүл мэнд",
          "Ажил ба нийгмийн даатгал",
          "Эрчим хүч",
          "Байгаль орчин",
          "Хот ба дэд бүтэц",
          "Засаглал"
        ]
      }
    },
    "featured": {
      "type": "boolean"
    },
    "order": {
      "type": "number"
    },
    "title": {
      "type": "string",
      "minLength": 1
    },
    "officialTitle": {
      "type": "object",
      "properties": {
        "text": {
          "type": "string",
          "minLength": 1
        },
        "source": {
          "type": "string",
          "minLength": 1
        },
        "verify": {
          "type": "string",
          "minLength": 1
        }
      },
      "required": [
        "text",
        "source"
      ],
      "additionalProperties": false
    },
    "summary": {
      "type": "object",
      "properties": {
        "text": {
          "type": "string",
          "minLength": 1
        },
        "source": {
          "type": "string",
          "minLength": 1
        },
        "verify": {
          "type": "string",
          "minLength": 1
        }
      },
      "required": [
        "text",
        "source"
      ],
      "additionalProperties": false
    },
    "publishedAt": {
      "type": "string",
      "pattern": "^\\d{4}-\\d{2}-\\d{2}$"
    },
    "updatedAt": {
      "type": "string",
      "pattern": "^\\d{4}-\\d{2}-\\d{2}$"
    },
    "reviewed": {
      "type": "object",
      "properties": {
        "by": {
          "type": "string",
          "minLength": 1
        },
        "date": {
          "anyOf": [
            {
              "type": "string",
              "const": "TODO_VERIFY"
            },
            {
              "type": "string",
              "pattern": "^\\d{4}-\\d{2}-\\d{2}$"
            }
          ]
        }
      },
      "required": [
        "by",
        "date"
      ],
      "additionalProperties": false
    },
    "timeline": {
      "type": "array",
      "items": {
        "type": "object",
        "properties": {
          "date": {
            "anyOf": [
              {
                "anyOf": [
                  {
                    "type": "string",
                    "const": "TODO_VERIFY"
                  },
                  {
                    "type": "string",
                    "pattern": "^\\d{4}-\\d{2}-\\d{2}$"
                  }
                ]
              },
              {
                "type": "null"
              }
            ]
          },
          "dateText": {
            "type": "string",
            "minLength": 1
          },
          "label": {
            "type": "string",
            "minLength": 1
          },
          "status": {
            "type": "string",
            "enum": [
              "done",
              "current",
              "upcoming"
            ]
          },
          "note": {
            "type": "string",
            "minLength": 1
          },
          "source": {
            "type": "string",
            "minLength": 1
          },
          "verify": {
            "type": "string",
            "minLength": 1
          }
        },
        "required": [
          "date",
          "label",
          "status"
        ],
        "additionalProperties": false
      }
    },
    "changes": {
      "type": "array",
      "items": {
        "type": "object",
        "properties": {
          "clause": {
            "type": "string",
            "minLength": 1
          },
          "plainBefore": {
            "type": "object",
            "properties": {
              "text": {
                "type": "string",
                "minLength": 1
              },
              "source": {
                "type": "string",
                "minLength": 1
              },
              "verify": {
                "type": "string",
                "minLength": 1
              }
            },
            "required": [
              "text",
              "source"
            ],
            "additionalProperties": false
          },
          "plainAfter": {
            "type": "object",
            "properties": {
              "text": {
                "type": "string",
                "minLength": 1
              },
              "source": {
                "type": "string",
                "minLength": 1
              },
              "verify": {
                "type": "string",
                "minLength": 1
              }
            },
            "required": [
              "text",
              "source"
            ],
            "additionalProperties": false
          },
          "lawBefore": {
            "type": "string"
          },
          "lawAfter": {
            "type": "string",
            "minLength": 1
          },
          "lawSource": {
            "type": "string",
            "minLength": 1
          },
          "effectiveFrom": {
            "type": "string",
            "pattern": "^\\d{4}-\\d{2}-\\d{2}$"
          }
        },
        "required": [
          "clause",
          "plainBefore",
          "plainAfter",
          "lawBefore",
          "lawAfter",
          "lawSource"
        ],
        "additionalProperties": false
      }
    },
    "keyNumbers": {
      "type": "array",
      "items": {
        "type": "object",
        "properties": {
          "label": {
            "type": "string",
            "minLength": 1
          },
          "value": {
            "type": "string",
            "minLength": 1
          },
          "note": {
            "type": "string",
            "minLength": 1
          },
          "source": {
            "type": "string",
            "minLength": 1
          },
          "verify": {
            "type": "string",
            "minLength": 1
          }
        },
        "required": [
          "label",
          "value",
          "source"
        ],
        "additionalProperties": false
      }
    },
    "numberExplainer": {
      "type": "object",
      "properties": {
        "question": {
          "type": "string",
          "minLength": 1
        },
        "paragraphs": {
          "minItems": 1,
          "type": "array",
          "items": {
            "type": "object",
            "properties": {
              "text": {
                "type": "string",
                "minLength": 1
              },
              "source": {
                "type": "string",
                "minLength": 1
              },
              "verify": {
                "type": "string",
                "minLength": 1
              }
            },
            "required": [
              "text",
              "source"
            ],
            "additionalProperties": false
          }
        }
      },
      "required": [
        "question",
        "paragraphs"
      ],
      "additionalProperties": false
    },
    "meaning": {
      "type": "array",
      "items": {
        "type": "object",
        "properties": {
          "text": {
            "type": "string",
            "minLength": 1
          },
          "source": {
            "type": "string",
            "minLength": 1
          },
          "verify": {
            "type": "string",
            "minLength": 1
          }
        },
        "required": [
          "text",
          "source"
        ],
        "additionalProperties": false
      }
    },
    "positions": {
      "type": "array",
      "items": {
        "type": "object",
        "properties": {
          "actor": {
            "type": "string",
            "minLength": 1
          },
          "text": {
            "type": "string",
            "minLength": 1
          },
          "source": {
            "type": "string",
            "minLength": 1
          },
          "verify": {
            "type": "string",
            "minLength": 1
          }
        },
        "required": [
          "actor",
          "text",
          "source"
        ],
        "additionalProperties": false
      }
    },
    "affects": {
      "type": "array",
      "items": {
        "type": "object",
        "properties": {
          "group": {
            "type": "string",
            "enum": [
              "Оюутан",
              "Ажилтан",
              "Бизнес эрхлэгч",
              "Иргэн",
              "Эцэг эх",
              "Тэтгэвэр авагч",
              "Ахмад настан",
              "Төрийн албан хаагч",
              "Төрийн байгууллага"
            ]
          },
          "text": {
            "type": "string",
            "minLength": 1
          },
          "source": {
            "type": "string",
            "minLength": 1
          },
          "verify": {
            "type": "string",
            "minLength": 1
          }
        },
        "required": [
          "group",
          "text",
          "source"
        ],
        "additionalProperties": false
      }
    },
    "evidence": {
      "type": "array",
      "items": {
        "type": "object",
        "properties": {
          "step": {
            "type": "string",
            "enum": [
              "Бодлого",
              "Төсөв",
              "Үр нөлөөний үнэлгээ",
              "Олон нийтийн санал"
            ]
          },
          "items": {
            "type": "array",
            "items": {
              "type": "object",
              "properties": {
                "text": {
                  "type": "string",
                  "minLength": 1
                },
                "source": {
                  "type": "string",
                  "minLength": 1
                },
                "verify": {
                  "type": "string",
                  "minLength": 1
                }
              },
              "required": [
                "text",
                "source"
              ],
              "additionalProperties": false
            }
          }
        },
        "required": [
          "step",
          "items"
        ],
        "additionalProperties": false
      }
    },
    "calculator": {
      "type": "string",
      "const": "pit"
    },
    "participate": {
      "type": "array",
      "items": {
        "type": "object",
        "properties": {
          "channel": {
            "type": "string",
            "enum": [
              "d-parliament",
              "legalinfo-bills",
              "legalinfo-regulations",
              "e-mongolia",
              "petition"
            ]
          },
          "label": {
            "type": "string",
            "minLength": 1
          },
          "url": {
            "type": "string",
            "pattern": "^https:\\/\\/\\S+$"
          },
          "note": {
            "type": "string",
            "minLength": 1
          }
        },
        "required": [
          "channel",
          "label"
        ],
        "additionalProperties": false
      }
    },
    "relatedStoryIds": {
      "type": "array",
      "items": {
        "type": "string",
        "minLength": 1
      }
    },
    "sources": {
      "minItems": 1,
      "type": "array",
      "items": {
        "type": "object",
        "properties": {
          "id": {
            "type": "string",
            "minLength": 1
          },
          "title": {
            "type": "string",
            "minLength": 1
          },
          "publisher": {
            "type": "string",
            "minLength": 1
          },
          "url": {
            "anyOf": [
              {
                "type": "string",
                "const": "TODO_VERIFY"
              },
              {
                "type": "string",
                "pattern": "^https:\\/\\/\\S+$"
              }
            ]
          },
          "publishedAt": {
            "anyOf": [
              {
                "type": "string",
                "const": "TODO_VERIFY"
              },
              {
                "type": "string",
                "pattern": "^\\d{4}-\\d{2}-\\d{2}$"
              }
            ]
          },
          "accessedAt": {
            "anyOf": [
              {
                "type": "string",
                "const": "TODO_VERIFY"
              },
              {
                "type": "string",
                "pattern": "^\\d{4}-\\d{2}-\\d{2}$"
              }
            ]
          },
          "kind": {
            "type": "string",
            "enum": [
              "official",
              "media"
            ]
          },
          "note": {
            "type": "string",
            "minLength": 1
          }
        },
        "required": [
          "id",
          "title",
          "publisher",
          "url",
          "accessedAt",
          "kind"
        ],
        "additionalProperties": false
      }
    },
    "corrections": {
      "type": "array",
      "items": {
        "type": "object",
        "properties": {
          "date": {
            "type": "string",
            "pattern": "^\\d{4}-\\d{2}-\\d{2}$"
          },
          "text": {
            "type": "string",
            "minLength": 1
          }
        },
        "required": [
          "date",
          "text"
        ],
        "additionalProperties": false
      }
    },
    "verify": {
      "type": "array",
      "items": {
        "type": "string",
        "minLength": 1
      }
    }
  },
  "required": [
    "id",
    "type",
    "stage",
    "topics",
    "featured",
    "title",
    "officialTitle",
    "summary",
    "publishedAt",
    "timeline",
    "meaning",
    "affects",
    "evidence",
    "participate",
    "sources"
  ],
  "additionalProperties": false
}
