{
  "id": "housing-16000",
  "type": "Засгийн газрын мэдэгдэл",
  "stage": "Танилцуулсан",
  "topics": ["Орон сууц"],
  "featured": false,
  "order": 3,
  "title": "16,000 орон сууцыг 6%-ийн зээлээр, түрээслээд өмчлөх нөхцөлөөр борлуулахаар төлөвлөжээ",
  "officialTitle": { "text": "Ерөнхий сайдын 2026.08.31-нд танилцуулсан есөн шийдвэр: 5. Орон сууц", "source": "gov-9-decisions" },
  "summary": { "text": "Ерөнхий сайдын танилцуулснаар 16,000 орон сууцыг 6%-ийн зээлээр, түрээслээд өмчлөх нөхцөлөөр борлуулж, төрийн 4,000 орон сууцны урьдчилгааг 30%-иас 15% болгоно.", "source": "gov-9-decisions" },
  "publishedAt": "2026-09-25",
  "timeline": [
    { "date": "2026-08-31", "label": "Ерөнхий сайд танилцуулсан", "status": "current", "source": "gov-9-decisions" },
    { "date": null, "label": "Эрх зүйн баримт бичиг (тогтоол, журам) гарах", "status": "upcoming" }
  ],
  "meaning": [
    { "text": "Төлөвлөгөө хэрэгжвэл төрийн 4,000 орон сууцны аль нэгийг авах иргэн урьдчилгаанд үнийн 30%-ийн оронд 15%-ийг төлнө.", "source": "gov-9-decisions" }
  ],
  "affects": [
    { "group": "Иргэн", "text": "Орон сууц авахаар төлөвлөж буй иргэдэд 6%-ийн зээл, түрээслээд өмчлөх нөхцөл санал болгохоор төлөвлөжээ.", "source": "gov-9-decisions" }
  ],
  "evidence": [
    { "step": "Төсөв", "items": [{ "text": "2027 оны төсвийн төсөлд 16 мянга орчим иргэнийг орон сууцтай болгох зорилт тусгажээ.", "source": "arslan-budget" }] }
  ],
  "participate": [
    { "channel": "legalinfo-regulations", "label": "Журмын төсөл гарвал санал өгөх" }
  ],
  "relatedStoryIds": ["budget-2027"],
  "sources": [
    { "id": "gov-9-decisions", "title": "Ерөнхий сайд Н.Учрал есөн шийдвэрээ танилцууллаа", "publisher": "Засгийн газрын хэвлэл мэдээлэл, олон нийттэй харилцах газар (mnb.mn)", "url": "https://www.mnb.mn/i/351468", "publishedAt": "2026-08-31", "accessedAt": "2026-09-22", "kind": "official" },
    { "id": "arslan-budget", "title": "МАН-ын бүлэг 2027 оны төсвийн төслийг хэлэлцлээ", "publisher": "arslan.mn", "url": "https://www.arslan.mn/politics/parliament/670676.shtml", "publishedAt": "2026-09-15", "accessedAt": "2026-09-23", "kind": "media" }
  ],
  "verify": [
    "Энэ шийдвэрийн эрх зүйн баримт бичгийг (Засгийн газрын тогтоол г.м.) legalinfo.mn-ээс хайж, олдвол төрөл, шатыг солих"
  ]
}
