{
  "id": "tax-package-2026",
  "type": "Хууль",
  "stage": "Батлагдсан",
  "topics": ["Татвар", "Ажил ба нийгмийн даатгал"],
  "featured": true,
  "order": 1,
  "title": "2027 оноос сарын 792,000₮ хүртэлх цалин татвараас чөлөөлөгдөнө",
  "officialTitle": {
    "text": "Татварын ерөнхий хууль, Аж ахуйн нэгжийн орлогын албан татварын тухай хууль, Хувь хүний орлогын албан татварын тухай хууль, Нэмэгдсэн өртгийн албан татварын тухай хуульд нэмэлт, өөрчлөлт оруулах тухай хуулиуд (татварын багц хууль)",
    "source": "ikon-tax",
    "verify": "Багцад орсон хууль тус бүрийн албан ёсны нэрийг legalinfo.mn-ээс тулгах"
  },
  "summary": {
    "text": "УИХ 2026 оны 6-р сарын 26-нд баталсан татварын багц хуулиар цалингийн орлогын албан татвар 2027, 2028 онд үе шаттай буурна.",
    "source": "ikon-tax"
  },
  "publishedAt": "2026-09-25",
  "reviewed": { "by": "TODO_VERIFY", "date": "TODO_VERIFY" },
  "timeline": [
    { "date": "2026-05-06", "label": "Засгийн газар УИХ-д өргөн барьсан", "status": "done", "source": "ikon-tax" },
    { "date": "2026-06-26", "label": "УИХ эцэслэн баталсан", "note": "Хуралдаанд оролцсон гишүүдийн 87.1% дэмжсэн", "status": "current", "source": "ikon-tax" },
    { "date": "2027-01-01", "label": "Мөрдөж эхэлнэ: 792,000₮ хүртэлх цалин татваргүй", "status": "upcoming", "source": "ikon-tax" },
    { "date": "2028-01-01", "label": "Мөрдөж эхэлнэ: 792,000–2,000,000₮ хэсэгт 1%", "status": "upcoming", "source": "ikon-tax" }
  ],
  "changes": [
    {
      "clause": "Хувь хүний орлогын албан татварын тухай хууль, зүйл, заалт: TODO_VERIFY",
      "plainBefore": { "text": "Сарын 2,000,000₮ цалинтай хүн 200,000₮ орлогын албан татвар төлдөг.", "source": "ikon-tax" },
      "plainAfter": { "text": "2028 оноос мөн хүн 12,000₮ орчим төлнө: 792,000₮ хүртэлх хэсэгт татвар ногдохгүй, 792,000–2,000,000₮ хэсэгт 1% ногдоно.", "source": "ikon-tax" },
      "lawBefore": "TODO_VERIFY",
      "lawAfter": "TODO_VERIFY",
      "lawSource": "legalinfo-pit",
      "effectiveFrom": "2028-01-01"
    },
    {
      "clause": "Хувь хүний орлогын албан татварын тухай хууль, зүйл, заалт: TODO_VERIFY",
      "plainBefore": { "text": "TODO_VERIFY", "source": "legalinfo-pit" },
      "plainAfter": { "text": "Сарын 792,000₮ хүртэлх цалингийн орлого хувь хүний орлогын албан татвараас чөлөөлөгдөнө.", "source": "ikon-tax" },
      "lawBefore": "TODO_VERIFY",
      "lawAfter": "TODO_VERIFY",
      "lawSource": "legalinfo-pit",
      "effectiveFrom": "2027-01-01"
    },
    {
      "clause": "Хувь хүний орлогын албан татварын тухай хууль, зүйл, заалт: TODO_VERIFY",
      "plainBefore": { "text": "TODO_VERIFY", "source": "legalinfo-pit" },
      "plainAfter": { "text": "Иргэн анх өмчилсөн орон сууцаа зарахад үл хөдлөх эд хөрөнгө борлуулсны татвараас бүрэн чөлөөлөгдөнө.", "source": "ikon-tax" },
      "lawBefore": "TODO_VERIFY",
      "lawAfter": "TODO_VERIFY",
      "lawSource": "legalinfo-pit",
      "effectiveFrom": "2027-01-01"
    }
  ],
  "meaning": [
    { "text": "2027 оны 1-р сарын 1-нээс сарын 792,000₮ хүртэлх цалингийн орлогод татвар ногдохгүй.", "source": "ikon-tax" },
    { "text": "2028 оны 1-р сарын 1-нээс 792,000₮-өөс 2,000,000₮ хүртэлх орлогод 1%-ийн шатлал үйлчилнэ.", "source": "ikon-tax" },
    { "text": "Жишээ нь сарын 2,000,000₮ цалинтай хүний татвар 200,000₮-өөс 12,000₮ орчим болж буурна.", "source": "ikon-tax" },
    { "text": "Засгийн газрын мэдээлснээр 792,000₮ хүртэлх цалинг татвараас чөлөөлснөөр иргэдийн гарт 840 тэрбум төгрөг үлдэнэ.", "source": "gov-9-decisions" }
  ],
  "affects": [
    { "group": "Ажилтан", "text": "Сарын цалин 792,000₮ хүртэл бол 2027 оноос цалингийн татвар ногдохгүй. 792,000–2,000,000₮ бол 2028 оноос тэр хэсэгт 1% ногдоно.", "source": "ikon-tax" },
    { "group": "Оюутан", "text": "Цалинтай ажил хийдэг оюутанд ажилтантай адил дүрэм үйлчилнэ.", "source": "ikon-tax", "verify": "Эх мэдээнд оюутны тухай тусгайлан дурдаагүй. Хуулийн эх бичвэрт оюутанд тусгай заалт байхгүйг шалгах" },
    { "group": "Бизнес эрхлэгч", "text": "Жилийн борлуулалтын орлого 1 тэрбум төгрөгөөс бага иргэн борлуулалтын орлогынхоо 1%-ийг татвар болгон төлнө.", "source": "ikon-tax" },
    { "group": "Бизнес эрхлэгч", "text": "1%-ийн татвар төлөх аж ахуйн нэгжийн жилийн борлуулалтын босго 1.5 тэрбумаас 2.5 тэрбум төгрөг болно.", "source": "ikon-tax" },
    { "group": "Бизнес эрхлэгч", "text": "НӨАТ суутган төлөгч болох босго 50 саяас 400 сая төгрөг болж нэмэгдэнэ.", "source": "ikon-tax" },
    { "group": "Иргэн", "text": "Анх өмчилсөн орон сууцаа зарахад үл хөдлөх эд хөрөнгө борлуулсны татвар төлөхгүй.", "source": "ikon-tax" }
  ],
  "evidence": [
    { "step": "Бодлого", "items": [{ "text": "Засгийн газар 2026 оны 5-р сарын 6-нд УИХ-д өргөн барьсан.", "source": "ikon-tax" }] },
    {
      "step": "Төсөв",
      "items": [
        { "text": "2027 оны төсвийн төсөлд цалингийн татварын энэ хөнгөлөлтөөр иргэдийн татварын ачаалал 840 тэрбум төгрөгөөр буурахаар тусгажээ.", "source": "arslan-budget" },
        { "text": "Засгийн газрын тайлбараар энэ хууль болон Нийгмийн даатгалын ерөнхий хуулийн өөрчлөлтөөр төсвийн тэнцвэржүүлсэн орлого батлагдсан дүнгээс 1 их наяд төгрөгөөр дутахаар болжээ.", "source": "ikon-fiscal-council" }
      ]
    },
    { "step": "Үр нөлөөний үнэлгээ", "items": [{ "text": "Хууль батлагдсанаар эдийн засаг нэмж 0.7 хувиар өсөх магадлалтай гэж тооцжээ.", "source": "ikon-tax", "verify": "Эх мэдээнд \"0.7 хувийн функцээр\" гэж бичсэн. Албан танилцуулгаас нэр томьёог шалгах." }] },
    { "step": "Олон нийтийн санал", "items": [] }
  ],
  "calculator": "pit",
  "participate": [
    { "channel": "e-mongolia", "label": "УИХ-д санал, хүсэлт илгээх" },
    { "channel": "petition", "label": "Нийтийн өргөдөл гаргах, дэмжих" }
  ],
  "relatedStoryIds": ["budget-2027", "student-contributions-2028"],
  "sources": [
    { "id": "ikon-tax", "title": "Татварын багц хуулийн төслийг эцэслэн баталлаа", "publisher": "ikon.mn", "url": "https://ikon.mn/n/3ojp", "publishedAt": "2026-06-26", "accessedAt": "2026-09-22", "kind": "media" },
    { "id": "legalinfo-pit", "title": "Хувь хүний орлогын албан татварын тухай хууль", "publisher": "legalinfo.mn", "url": "https://legalinfo.mn/mn/detail?lawId=14410", "accessedAt": "TODO_VERIFY", "kind": "official", "note": "Нэмэлт, өөрчлөлт орсон заалтыг \"харьцуулж харах\" хэсгээс авна." },
    { "id": "arslan-budget", "title": "МАН-ын бүлэг 2027 оны төсвийн төслийг хэлэлцлээ", "publisher": "arslan.mn", "url": "https://www.arslan.mn/politics/parliament/670676.shtml", "publishedAt": "2026-09-15", "accessedAt": "2026-09-23", "kind": "media" },
    { "id": "gov-9-decisions", "title": "Ерөнхий сайд Н.Учрал есөн шийдвэрээ танилцууллаа", "publisher": "Засгийн газрын хэвлэл мэдээлэл, олон нийттэй харилцах газар (mnb.mn)", "url": "https://www.mnb.mn/i/351468", "publishedAt": "2026-08-31", "accessedAt": "2026-09-22", "kind": "official" },
    { "id": "ikon-fiscal-council", "title": "Төсвийн зарлагыг хожим бууруулж болох мэтээр өсгөөд байна. Зарлагаа бууруулах гэж ямар сорилттой тулгардгийг өнгөрсөн жил харсан", "publisher": "ikon.mn", "url": "https://ikon.mn/n/3qcr", "publishedAt": "2026-09-16", "accessedAt": "2026-09-23", "kind": "media", "note": "Төсвийн тогтвортой байдлын зөвлөлийн дүгнэлтийг мэдээлсэн" }
  ],
  "verify": [
    "Өөрчлөгдсөн заалтуудын дугаар, өмнөх ба шинэ эх бичвэрийг legalinfo.mn-ээс оруулах",
    "87.1%-ийн санал хураалтын дүнг parliament.mn-ийн хуралдааны тэмдэглэлээс баталгаажуулах",
    "Хууль «Төрийн мэдээлэл»-д нийтлэгдсэн, Ерөнхийлөгч хориг тавиагүй эсэхийг шалгаж, нийтлэгдсэн бол stage-ийг «Нийтлэгдсэн» болгох",
    "Төслийг олон нийтээр хэлэлцүүлсэн мэдээлэл (legalinfo.mn, d.parliament.mn) олдвол «Олон нийтийн санал» алхамд нэмэх"
  ]
}
