{
  "id": "student-contributions-2028",
  "type": "Хууль",
  "stage": "Батлагдсан",
  "topics": ["Ажил ба нийгмийн даатгал", "Боловсрол"],
  "featured": false,
  "order": 4,
  "title": "Ажил хийдэг оюутан 2028 оноос хүсвэл нийгмийн даатгалын шимтгэлээс чөлөөлөгдөнө",
  "officialTitle": { "text": "Нийгмийн даатгалын ерөнхий хуульд нэмэлт, өөрчлөлт оруулах тухай хууль", "source": "ndaatgal-students" },
  "summary": { "text": "УИХ 2026 оны 7-р сарын 2-нд баталсан хуулиар ажил хийдэг оюутан, суралцагч 2028 оны 1-р сарын 1-нээс өөрөө хүсвэл тэтгэвэр, тэтгэмж, ажилгүйдлийн даатгалын шимтгэлээс чөлөөлөгдөх боломжтой болно.", "source": "ndaatgal-students" },
  "publishedAt": "2026-09-25",
  "timeline": [
    { "date": "2026-07-02", "label": "УИХ баталсан", "status": "current", "source": "ndaatgal-students", "verify": "Төсвийн тогтвортой байдлын зөвлөлийн дүгнэлтэд (ikon.mn/n/3qcr) 2026.07.03 гэжээ. legalinfo.mn дээрх хуулийн огноог шалгах" },
    { "date": "2028-01-01", "label": "Мөрдөж эхэлнэ", "status": "upcoming", "source": "ndaatgal-students" }
  ],
  "changes": [
    {
      "clause": "Нийгмийн даатгалын ерөнхий хууль, 7 дугаар зүйлийн 7.13 дахь хэсэг",
      "plainBefore": { "text": "Ажил хийдэг оюутан, суралцагчийг шимтгэлээс чөлөөлөх зохицуулалт байгаагүй.", "source": "ndaatgal-students" },
      "plainAfter": { "text": "Ажил хийдэг оюутан, суралцагч өөрөө хүсвэл тэтгэврийн даатгалын 8.5%, тэтгэмжийн даатгалын 1.0%, ажилгүйдлийн даатгалын 0.5%-ийн шимтгэлээс чөлөөлөгдөж болно.", "source": "ndaatgal-students" },
      "lawBefore": "TODO_VERIFY",
      "lawAfter": "TODO_VERIFY",
      "lawSource": "legalinfo-sia",
      "effectiveFrom": "2028-01-01"
    }
  ],
  "meaning": [
    { "text": "Чөлөөлөлт сонголттой: оюутан, суралцагч өөрөө хүсвэл л шимтгэлээс чөлөөлөгдөнө.", "source": "ndaatgal-students" },
    { "text": "Чөлөөлөгдсөн хугацааны тэтгэврийн даатгалын шимтгэлээ 26 нас хүрэхээсээ өмнө өөрөө нөхөн төлж болно.", "source": "mlsp-social-insurance" },
    { "text": "Мэргэжлийн болон техникийн боловсрол, дэд бакалавр, бакалаврын хөтөлбөрт суралцаж буй 15–24 насны суралцагчид хамаарна.", "source": "mlsp-social-insurance" }
  ],
  "affects": [
    { "group": "Оюутан", "text": "Ажил хийдэг бол 2028 оноос тэтгэвэр, тэтгэмж, ажилгүйдлийн даатгалын шимтгэлээс чөлөөлөгдөх эсэхээ өөрөө сонгоно.", "source": "ndaatgal-students" },
    { "group": "Бизнес эрхлэгч", "text": "Оюутан, суралцагч ажиллуулж буй ажил олгогч зөвхөн үйлдвэрлэлийн осол, мэргэжлээс шалтгаалах өвчний даатгалын шимтгэл төлнө.", "source": "mlsp-social-insurance", "verify": "Энэ нь оюутан чөлөөлөгдөхийг сонгосон үед л үйлчлэх эсэхийг хуулийн 7.13-аас шалгах" }
  ],
  "evidence": [
    { "step": "Төсөв", "items": [{ "text": "Засгийн газрын тайлбараар энэ хууль болон Хувь хүний орлогын албан татварын тухай хуулийн өөрчлөлтөөр төсвийн тэнцвэржүүлсэн орлого батлагдсан дүнгээс 1 их наяд төгрөгөөр дутахаар болжээ.", "source": "ikon-fiscal-council" }] }
  ],
  "participate": [
    { "channel": "e-mongolia", "label": "УИХ-д санал, хүсэлт илгээх" }
  ],
  "relatedStoryIds": ["tax-package-2026", "budget-2027"],
  "sources": [
    { "id": "ndaatgal-students", "title": "Ажил, хөдөлмөр эрхэлж байгаа оюутан, суралцагч суралцах хугацаандаа нийгмийн даатгалаас чөлөөлөгдөх боломжтой боллоо", "publisher": "Нийгмийн даатгалын ерөнхий газар", "url": "https://www.ndaatgal.mn/%D0%B0%D0%B6%D0%B8%D0%BB-%D1%85%D3%A9%D0%B4%D3%A9%D0%BB%D0%BC%D3%A9%D1%80-%D1%8D%D1%80%D1%85%D1%8D%D0%BB%D0%B6-%D0%B1%D0%B0%D0%B9%D0%B3%D0%B0%D0%B0-%D0%BE%D1%8E%D1%83%D1%82%D0%B0%D0%BD-%D1%81%D1%83/", "publishedAt": "2026-09-17", "accessedAt": "2026-09-23", "kind": "official", "note": "Хуулийн 7 дугаар зүйлийн 7.13 дахь хэсгийг эх сурвалж болгосон" },
    { "id": "mlsp-social-insurance", "title": "Нийгмийн даатгалын багц хуульд нэмэлт, өөрчлөлт оруулах тухай хууль батлагдлаа", "publisher": "Хөдөлмөр, нийгмийн хамгааллын яам", "url": "https://mlsp.gov.mn/content/detail/4131", "publishedAt": "2026-07-02", "accessedAt": "2026-09-23", "kind": "official" },
    { "id": "legalinfo-sia", "title": "Нийгмийн даатгалын ерөнхий хууль", "publisher": "legalinfo.mn", "url": "https://legalinfo.mn/mn/detail?lawId=16760148379551", "accessedAt": "TODO_VERIFY", "kind": "official", "note": "7.13 дахь хэсгийг нэмэлт, өөрчлөлт орсон хувилбараас авна." },
    { "id": "ikon-fiscal-council", "title": "Төсвийн зарлагыг хожим бууруулж болох мэтээр өсгөөд байна. Зарлагаа бууруулах гэж ямар сорилттой тулгардгийг өнгөрсөн жил харсан", "publisher": "ikon.mn", "url": "https://ikon.mn/n/3qcr", "publishedAt": "2026-09-16", "accessedAt": "2026-09-23", "kind": "media", "note": "Төсвийн тогтвортой байдлын зөвлөлийн дүгнэлтийг мэдээлсэн" }
  ],
  "verify": [
    "7.13 дахь хэсгийн өмнөх ба шинэ эх бичвэрийг legalinfo.mn-ээс оруулах",
    "Ерөнхий сайдын 2026.08.31-ний танилцуулгад (mnb.mn/i/351468) ажил хийдэг ахмад настан 2027 оноос шимтгэл төлөхгүй гэжээ. Энэ заалт мөн хуульд байгаа эсэхийг шалгаж, байвал affects, timeline-д нэмэх"
  ]
}
