{
  "id": "emeelt-power-plant",
  "type": "Хөрөнгө оруулалтын төсөл",
  "stage": "Хэрэгжиж байна",
  "topics": ["Эрчим хүч", "Хот ба дэд бүтэц"],
  "featured": false,
  "order": 6,
  "title": "Эмээлт аж үйлдвэрийн паркийн дулааны цахилгаан станц, цэвэрлэх байгууламжийн шавыг тавилаа",
  "officialTitle": { "text": "TODO_VERIFY", "source": "TODO_VERIFY", "verify": "Төслийн албан нэр, хэрэгжүүлэгч байгууллагыг олох" },
  "summary": { "text": "Төсөвт өртөг нь 224.6 тэрбум төгрөгийн дулааны цахилгаан станц болон цэвэрлэх байгууламжийн шавыг тавьжээ.", "source": "ikon-emeelt" },
  "publishedAt": "2026-09-25",
  "timeline": [
    { "date": "2026-09-21", "label": "Шав тавьсан", "status": "current", "source": "ikon-emeelt" },
    { "date": null, "dateText": "2028 он", "label": "Ажлыг дуусгах хугацаа", "status": "upcoming", "source": "ikon-emeelt" }
  ],
  "keyNumbers": [
    { "label": "Төсөвт өртөг", "value": "224.6 тэрбум төгрөг", "note": "2025–2028 онд", "source": "ikon-emeelt" },
    { "label": "Санхүүжилтийн эх үүсвэр", "value": "Нийслэлийн төсөв", "note": "2026 онд 50 тэрбум төгрөг", "source": "ikon-emeelt", "verify": "Мэдээнд «нийслэлийн 2026 оны төсвийн жагсаалтад тусгасан» гэжээ. Нийслэлийн төсвийн шийдвэр эсвэл shilendans.gov.mn-ээс тулгах" }
  ],
  "meaning": [
    { "text": "Эмээлт эко аж үйлдвэрийн паркийг Хан-Уул дүүргийн 13 дугаар хороонд, хотын төвөөс 30 км зайд 539 га газарт байгуулахаар төлөвлөжээ.", "source": "ikon-emeelt", "verify": "Claude мэдээнээс бичсэн — хүн шалгах" },
    { "text": "Дулааны цахилгаан станц 24 МВт, цэвэрлэх байгууламж хоногт 6,700 м³ бохир ус цэвэрлэх хүчин чадалтай байхаар төлөвлөгджээ.", "source": "ikon-emeelt", "verify": "Claude мэдээнээс бичсэн — хүн шалгах" }
  ],
  "affects": [
    { "group": "Иргэн", "text": "Харгиа орчмын арьс шир, ноос боловсруулах үйлдвэрүүдийг Эмээлтэд үе шаттай төвлөрүүлснээр Хан-Уул дүүргийн 19, 20 дугаар хорооны иргэдийн амьдрах орчин сайжрах боломжтой гэж тооцжээ.", "source": "ikon-emeelt", "verify": "Claude мэдээнээс бичсэн — хүн шалгах" }
  ],
  "evidence": [
    { "step": "Төсөв", "items": [{ "text": "Нийслэлийн 2026 оны төсвийн жагсаалтад тусгагдсан бөгөөд энэ онд 50 тэрбум төгрөг зарцуулахаар баталжээ.", "source": "ikon-emeelt" }] }
  ],
  "participate": [
    { "channel": "e-mongolia", "label": "УИХ-д санал, хүсэлт илгээх" }
  ],
  "sources": [
    { "id": "ikon-emeelt", "title": "Эмээлт аж үйлдвэрийн паркийн ₮224 гаруй тэрбумын төсөвт өртөгтэй ДЦС болон цэвэрлэх байгууламжийн шавыг тавив", "publisher": "ikon.mn", "url": "https://ikon.mn/n/3qh8", "publishedAt": "2026-09-22", "accessedAt": "2026-09-23", "kind": "media", "note": "Бүтэн мэдээг 2026.09.23-нд уншсан" }
  ]
}
